[
  {"case_id":"happy-0a-draft-validates","kind":"happy","argv":["uv","run","pytest","tests/gates/test_policy_schema.py::test_0a_draft_validates_when_results_and_bindings_are_unfilled","-q"],"stdin_fixture":null,"environment":{},"fault_fixture":null,"expected_exit":0,"expected_artifacts":[],"expected_observation":"1 passed"},
  {"case_id":"failure-signature-field","kind":"failure","argv":["uv","run","pytest","tests/gates/test_policy_schema.py::test_signature_like_field_is_rejected","-q"],"stdin_fixture":null,"environment":{},"fault_fixture":null,"expected_exit":0,"expected_artifacts":[],"expected_observation":"2 passed"},
  {"case_id":"failure-prefilled-observed-result","kind":"failure","argv":["uv","run","pytest","tests/gates/test_policy_schema.py::test_prefilled_observed_result_is_rejected_from_policy","-q"],"stdin_fixture":null,"environment":{},"fault_fixture":null,"expected_exit":0,"expected_artifacts":[],"expected_observation":"4 passed"},
  {"case_id":"failure-noncanonical-value","kind":"failure","argv":["uv","run","pytest","tests/gates/test_policy_schema.py::test_float_is_rejected_when_nested_anywhere_in_policy","-q"],"stdin_fixture":null,"environment":{},"fault_fixture":null,"expected_exit":0,"expected_artifacts":[],"expected_observation":"2 passed"},
  {"case_id":"failure-missing-stop-criterion","kind":"failure","argv":["uv","run","pytest","tests/gates/test_phase_allowlist.py::test_missing_stop_criterion_is_rejected","-q"],"stdin_fixture":null,"environment":{},"fault_fixture":null,"expected_exit":0,"expected_artifacts":[],"expected_observation":"1 passed"},
  {"case_id":"failure-later-phase-capability","kind":"failure","argv":["uv","run","pytest","tests/gates/test_phase_allowlist.py::test_later_phase_capability_is_rejected_from_0a_allowlist","-q"],"stdin_fixture":null,"environment":{},"fault_fixture":null,"expected_exit":0,"expected_artifacts":[],"expected_observation":"5 passed"},
  {"case_id":"failure-unknown-prerequisite-kind","kind":"failure","argv":["uv","run","pytest","tests/gates/test_policy_schema.py::test_unknown_prerequisite_kind_is_rejected","-q"],"stdin_fixture":null,"environment":{},"fault_fixture":null,"expected_exit":0,"expected_artifacts":[],"expected_observation":"1 passed"},
  {"case_id":"failure-operator-binding-missing-field","kind":"failure","argv":["uv","run","pytest","tests/gates/test_policy_schema.py::test_operator_checkpoint_requires_all_target_and_receipt_hashes","-q"],"stdin_fixture":null,"environment":{},"fault_fixture":null,"expected_exit":0,"expected_artifacts":[],"expected_observation":"1 passed"},
  {"case_id":"failure-schema-drift","kind":"failure","argv":["uv","run","pytest","tests/gates/test_policy_schema.py::test_gate_schema_drift_is_detected_when_exported_copy_is_tampered","-q"],"stdin_fixture":null,"environment":{},"fault_fixture":null,"expected_exit":0,"expected_artifacts":[],"expected_observation":"1 passed"},
  {"case_id":"failure-misleading-canonical-success","kind":"failure","argv":["uv","run","pytest","tests/gates/test_policy_schema.py::test_canonical_bytes_are_stable_for_equivalent_policy_input","-q"],"stdin_fixture":null,"environment":{},"fault_fixture":null,"expected_exit":0,"expected_artifacts":[],"expected_observation":"1 passed"}
]
