[
  {"case_id":"happy-cfr-exact-vectors","kind":"happy","argv":["uv","run","python","-m","services.conform.cli","cfr-vector"],"stdin_fixture":null,"environment":{},"fault_fixture":null,"expected_exit":0,"expected_artifacts":[],"expected_observation":"cfr exact vectors ok"},
  {"case_id":"failure-drop-frame-boundary-mismatch","kind":"failure","argv":["uv","run","python","-m","services.conform.cli","span-boundary","--fps-num","30000","--fps-den","1001","--frames","600","--target-num","30","--target-den","1","--expect-output","600","--expect-duplicated","500"],"stdin_fixture":null,"environment":{},"fault_fixture":null,"expected_exit":2,"expected_artifacts":[],"expected_observation":"error=drop_frame_boundary_mismatch"},
  {"case_id":"failure-negative-span","kind":"failure","argv":["uv","run","python","-m","services.conform.cli","convert-span","--start-frame","-5","--end-frame","10","--fps-num","30000","--fps-den","1001","--timeline-num","30","--timeline-den","1","--base","0"],"stdin_fixture":null,"environment":{},"fault_fixture":null,"expected_exit":2,"expected_artifacts":[],"expected_observation":"error=negative_span"},
  {"case_id":"failure-inverted-span","kind":"failure","argv":["uv","run","python","-m","services.conform.cli","convert-span","--start-frame","10","--end-frame","5","--fps-num","30000","--fps-den","1001","--timeline-num","30","--timeline-den","1","--base","0"],"stdin_fixture":null,"environment":{},"fault_fixture":null,"expected_exit":2,"expected_artifacts":[],"expected_observation":"error=inverted_span"},
  {"case_id":"failure-overflow","kind":"failure","argv":["uv","run","python","-m","services.conform.cli","convert-pts","--pts","9223372036854775808","--time-base-num","1","--time-base-den","90000","--fps-num","30000","--fps-den","1001"],"stdin_fixture":null,"environment":{},"fault_fixture":null,"expected_exit":2,"expected_artifacts":[],"expected_observation":"error=coordinate_overflow"},
  {"case_id":"failure-non-monotonic-pts","kind":"failure","argv":["uv","run","python","-m","services.conform.cli","pts-sequence","--pts","0,3003,6006,3003","--time-base-num","1","--time-base-den","90000"],"stdin_fixture":null,"environment":{},"fault_fixture":null,"expected_exit":2,"expected_artifacts":[],"expected_observation":"error=non_monotonic_pts"},
  {"case_id":"failure-off-by-one","kind":"failure","argv":["uv","run","python","-m","services.conform.cli","convert-span","--start-frame","0","--end-frame","600","--fps-num","30000","--fps-den","1001","--timeline-num","30","--timeline-den","1","--base","0","--expect-record-length","600"],"stdin_fixture":null,"environment":{},"fault_fixture":null,"expected_exit":2,"expected_artifacts":[],"expected_observation":"error=off_by_one"}
]
