[
  {
    "case_id": "happy-ab-brand-inputs-frozen-before-implementation",
    "kind": "happy",
    "argv": [
      "uv",
      "run",
      "pytest",
      "tests/presentation/test_fixture_packages.py",
      "-q"
    ],
    "stdin_fixture": null,
    "environment": {},
    "fault_fixture": null,
    "expected_exit": 0,
    "expected_artifacts": [],
    "expected_observation": "11 passed"
  },
  {
    "case_id": "failure-unknown-asset-kind-refused",
    "kind": "failure",
    "argv": [
      "uv",
      "run",
      "pytest",
      "tests/presentation/test_fixture_packages.py::test_unknown_asset_kind_is_refused",
      "-q"
    ],
    "stdin_fixture": null,
    "environment": {},
    "fault_fixture": null,
    "expected_exit": 0,
    "expected_artifacts": [],
    "expected_observation": "1 passed"
  },
  {
    "case_id": "failure-missing-asset-license-refused",
    "kind": "failure",
    "argv": [
      "uv",
      "run",
      "pytest",
      "tests/presentation/test_fixture_packages.py::test_missing_asset_license_is_refused",
      "-q"
    ],
    "stdin_fixture": null,
    "environment": {},
    "fault_fixture": null,
    "expected_exit": 0,
    "expected_artifacts": [],
    "expected_observation": "1 passed"
  },
  {
    "case_id": "failure-editorial-difference-refused",
    "kind": "failure",
    "argv": [
      "uv",
      "run",
      "pytest",
      "tests/presentation/test_fixture_packages.py::test_editorial_difference_between_brands_is_refused",
      "-q"
    ],
    "stdin_fixture": null,
    "environment": {},
    "fault_fixture": null,
    "expected_exit": 0,
    "expected_artifacts": [],
    "expected_observation": "1 passed"
  },
  {
    "case_id": "failure-stale-parent-refused",
    "kind": "failure",
    "argv": [
      "uv",
      "run",
      "pytest",
      "tests/gates/test_phase3_inputs.py::test_stale_parent_gate_result_is_refused_at_prepare_time",
      "-q"
    ],
    "stdin_fixture": null,
    "environment": {},
    "fault_fixture": null,
    "expected_exit": 0,
    "expected_artifacts": [],
    "expected_observation": "1 passed"
  },
  {
    "case_id": "failure-pre-existing-phase3-module-refused",
    "kind": "failure",
    "argv": [
      "uv",
      "run",
      "pytest",
      "tests/gates/test_phase3_inputs.py::test_pre_existing_phase3_product_module_is_refused",
      "-q"
    ],
    "stdin_fixture": null,
    "environment": {},
    "fault_fixture": null,
    "expected_exit": 0,
    "expected_artifacts": [],
    "expected_observation": "1 passed"
  },
  {
    "case_id": "failure-same-version-refreeze-refused",
    "kind": "failure",
    "argv": [
      "uv",
      "run",
      "pytest",
      "tests/gates/test_phase3_inputs.py::test_same_version_refreeze_is_refused",
      "-q"
    ],
    "stdin_fixture": null,
    "environment": {},
    "fault_fixture": null,
    "expected_exit": 0,
    "expected_artifacts": [],
    "expected_observation": "1 passed"
  }
]
