[
  {
    "case_id": "happy-all-declared-clear-fixture-commands-validate",
    "kind": "happy",
    "argv": [
      "uv",
      "run",
      "pytest",
      "tests/review_command/test_contracts.py::test_clear_fixture_proposal_validates_clear_and_apply_eligible",
      "-q"
    ],
    "stdin_fixture": null,
    "environment": {},
    "fault_fixture": null,
    "expected_exit": 0,
    "expected_artifacts": [
      "tests/fixtures/manifests/phase-0c/p0c-remove-clear.json",
      "tests/fixtures/manifests/phase-0c/p0c-span-clear.json",
      "tests/fixtures/manifests/phase-0c/p0c-subtitle-clear.json"
    ],
    "expected_observation": "3 passed"
  },
  {
    "case_id": "failure-missing-decision-context-rejected",
    "kind": "failure",
    "argv": [
      "uv",
      "run",
      "pytest",
      "tests/review_command/test_contracts.py::test_decision_payload_smuggling_is_rejected",
      "-q"
    ],
    "stdin_fixture": null,
    "environment": {},
    "fault_fixture": null,
    "expected_exit": 0,
    "expected_artifacts": [],
    "expected_observation": "6 passed"
  },
  {
    "case_id": "failure-two-viable-targets-defer-needs-human",
    "kind": "failure",
    "argv": [
      "uv",
      "run",
      "pytest",
      "tests/review_command/test_contracts.py::test_ambiguous_fixture_classifies_ambiguous_defer_needs_human",
      "tests/review_command/test_contracts.py::test_authored_clear_claim_with_two_viable_targets_still_classifies_ambiguous",
      "-q"
    ],
    "stdin_fixture": null,
    "environment": {},
    "fault_fixture": null,
    "expected_exit": 0,
    "expected_artifacts": [],
    "expected_observation": "2 passed"
  },
  {
    "case_id": "failure-stale-plan-rejected",
    "kind": "failure",
    "argv": [
      "uv",
      "run",
      "pytest",
      "tests/review_command/test_contracts.py::test_stale_base_plan_version_is_rejected",
      "-q"
    ],
    "stdin_fixture": null,
    "environment": {},
    "fault_fixture": null,
    "expected_exit": 0,
    "expected_artifacts": [],
    "expected_observation": "1 passed"
  },
  {
    "case_id": "failure-locked-field-defer",
    "kind": "failure",
    "argv": [
      "uv",
      "run",
      "pytest",
      "tests/review_command/test_contracts.py::test_locked_fixture_classifies_conflict_defer",
      "tests/review_command/test_contracts.py::test_lock_rules_per_kind",
      "-q"
    ],
    "stdin_fixture": null,
    "environment": {},
    "fault_fixture": null,
    "expected_exit": 0,
    "expected_artifacts": [
      "tests/fixtures/manifests/phase-0c/p0c-locked-conflict.json"
    ],
    "expected_observation": "4 passed"
  },
  {
    "case_id": "failure-model-authored-approval-rejected",
    "kind": "failure",
    "argv": [
      "uv",
      "run",
      "pytest",
      "tests/review_command/test_contracts.py::test_model_authored_approval_is_rejected",
      "-q"
    ],
    "stdin_fixture": null,
    "environment": {},
    "fault_fixture": null,
    "expected_exit": 0,
    "expected_artifacts": [],
    "expected_observation": "1 passed"
  }
]
