[
  {
    "case_id": "happy-fixed-presentation-renders",
    "kind": "happy",
    "argv": [
      "uv",
      "run",
      "pytest",
      "tests/build/test_phase2_presentation.py::test_offline_presentation_routes_roles_and_renders",
      "-q"
    ],
    "stdin_fixture": null,
    "environment": {},
    "fault_fixture": null,
    "expected_exit": 0,
    "expected_artifacts": [],
    "expected_observation": "1 passed"
  },
  {
    "case_id": "failure-style-swap-rejected",
    "kind": "failure",
    "argv": [
      "uv",
      "run",
      "pytest",
      "tests/build/test_phase2_presentation.py::test_offline_style_swap_is_typed_scope_failure",
      "-q"
    ],
    "stdin_fixture": null,
    "environment": {},
    "fault_fixture": null,
    "expected_exit": 0,
    "expected_artifacts": [],
    "expected_observation": "1 passed"
  },
  {
    "case_id": "failure-unapproved-asset-rejected",
    "kind": "failure",
    "argv": [
      "uv",
      "run",
      "pytest",
      "tests/build/test_phase2_presentation.py::test_offline_unapproved_asset_is_typed_failure",
      "-q"
    ],
    "stdin_fixture": null,
    "environment": {},
    "fault_fixture": null,
    "expected_exit": 0,
    "expected_artifacts": [],
    "expected_observation": "1 passed"
  },
  {
    "case_id": "failure-dialogue-ambient-conflation-rejected",
    "kind": "failure",
    "argv": [
      "uv",
      "run",
      "pytest",
      "tests/build/test_phase2_presentation.py::test_offline_role_conflation_is_typed_failure",
      "-q"
    ],
    "stdin_fixture": null,
    "environment": {},
    "fault_fixture": null,
    "expected_exit": 0,
    "expected_artifacts": [],
    "expected_observation": "1 passed"
  },
  {
    "case_id": "failure-unsupported-fairlight-fusion-rejected",
    "kind": "failure",
    "argv": [
      "uv",
      "run",
      "pytest",
      "tests/build/test_phase2_presentation.py::test_offline_phase3_keys_are_typed_scope_failures",
      "-q"
    ],
    "stdin_fixture": null,
    "environment": {},
    "fault_fixture": null,
    "expected_exit": 0,
    "expected_artifacts": [],
    "expected_observation": "11 passed"
  },
  {
    "case_id": "failure-channel-branch-rejected",
    "kind": "failure",
    "argv": [
      "uv",
      "run",
      "pytest",
      "tests/build/test_phase2_presentation.py::test_offline_channel_branch_is_typed_scope_failure",
      "-q"
    ],
    "stdin_fixture": null,
    "environment": {},
    "fault_fixture": null,
    "expected_exit": 0,
    "expected_artifacts": [],
    "expected_observation": "1 passed"
  }
]
