[
  {
    "case_id": "happy-render-decode-metadata-pass",
    "kind": "happy",
    "argv": [
      "uv",
      "run",
      "pytest",
      "tests/build/test_render.py::test_offline_happy_render_validates_and_binds",
      "-q"
    ],
    "stdin_fixture": null,
    "environment": {},
    "fault_fixture": null,
    "expected_exit": 0,
    "expected_artifacts": [],
    "expected_observation": "1 passed"
  },
  {
    "case_id": "failure-false-complete-status",
    "kind": "failure",
    "argv": [
      "uv",
      "run",
      "pytest",
      "tests/build/test_render.py::test_offline_false_complete_status_fails_permanently",
      "-q"
    ],
    "stdin_fixture": null,
    "environment": {},
    "fault_fixture": null,
    "expected_exit": 0,
    "expected_artifacts": [],
    "expected_observation": "1 passed"
  },
  {
    "case_id": "failure-missing-partial-file",
    "kind": "failure",
    "argv": [
      "uv",
      "run",
      "pytest",
      "tests/build/test_render.py::test_offline_missing_output_fails_typed",
      "tests/build/test_render.py::test_offline_partial_truncated_output_fails_decode",
      "-q"
    ],
    "stdin_fixture": null,
    "environment": {},
    "fault_fixture": null,
    "expected_exit": 0,
    "expected_artifacts": [],
    "expected_observation": "2 passed"
  },
  {
    "case_id": "failure-timeout-retry-then-fail",
    "kind": "failure",
    "argv": [
      "uv",
      "run",
      "pytest",
      "tests/build/test_render.py::test_offline_timeout_retries_bounded_then_fails_typed",
      "-q"
    ],
    "stdin_fixture": null,
    "environment": {},
    "fault_fixture": null,
    "expected_exit": 0,
    "expected_artifacts": [],
    "expected_observation": "1 passed"
  },
  {
    "case_id": "failure-wrong-preset-path-timeline",
    "kind": "failure",
    "argv": [
      "uv",
      "run",
      "pytest",
      "tests/build/test_render.py::test_offline_wrong_preset_binding_fails_typed",
      "tests/build/test_render.py::test_offline_non_allowlisted_path_refused",
      "tests/build/test_render.py::test_offline_wrong_fingerprint_fails_typed",
      "-q"
    ],
    "stdin_fixture": null,
    "environment": {},
    "fault_fixture": null,
    "expected_exit": 0,
    "expected_artifacts": [],
    "expected_observation": "3 passed"
  },
  {
    "case_id": "failure-decode-metadata-mismatch",
    "kind": "failure",
    "argv": [
      "uv",
      "run",
      "pytest",
      "tests/build/test_render.py::test_offline_decode_corrupt_output_fails_typed",
      "tests/build/test_render.py::test_offline_metadata_mismatch_fails_typed",
      "-q"
    ],
    "stdin_fixture": null,
    "environment": {},
    "fault_fixture": null,
    "expected_exit": 0,
    "expected_artifacts": [],
    "expected_observation": "2 passed"
  }
]
