[
  {
    "case_id": "happy-allowed-local-stage",
    "kind": "happy",
    "argv": [
      "uv",
      "run",
      "pytest",
      "tests/security/test_policy.py::test_allowed_local_stage_processes_without_cloud_transport",
      "-q"
    ],
    "stdin_fixture": null,
    "environment": {},
    "fault_fixture": null,
    "expected_exit": 0,
    "expected_artifacts": [],
    "expected_observation": "1 passed"
  },
  {
    "case_id": "happy-explicitly-allowed-synthetic-text-request",
    "kind": "happy",
    "argv": [
      "uv",
      "run",
      "pytest",
      "tests/security/test_policy.py::test_explicitly_allowed_synthetic_text_request",
      "-q"
    ],
    "stdin_fixture": null,
    "environment": {},
    "fault_fixture": null,
    "expected_exit": 0,
    "expected_artifacts": [],
    "expected_observation": "1 passed"
  },
  {
    "case_id": "failure-transcript-injection-denied",
    "kind": "failure",
    "argv": [
      "uv",
      "run",
      "pytest",
      "tests/security/test_policy.py::test_transcript_injection_transport_denied",
      "-q"
    ],
    "stdin_fixture": null,
    "environment": {},
    "fault_fixture": null,
    "expected_exit": 0,
    "expected_artifacts": [],
    "expected_observation": "1 passed"
  },
  {
    "case_id": "failure-cloud-without-permission-denied",
    "kind": "failure",
    "argv": [
      "uv",
      "run",
      "pytest",
      "tests/security/test_policy.py::test_cloud_upload_without_data_class_permission_denied",
      "-q"
    ],
    "stdin_fixture": null,
    "environment": {},
    "fault_fixture": null,
    "expected_exit": 0,
    "expected_artifacts": [],
    "expected_observation": "1 passed"
  },
  {
    "case_id": "failure-network-bind-refused",
    "kind": "failure",
    "argv": [
      "uv",
      "run",
      "pytest",
      "tests/security/test_policy.py::test_network_bind_to_non_loopback_refused",
      "-q"
    ],
    "stdin_fixture": null,
    "environment": {},
    "fault_fixture": null,
    "expected_exit": 0,
    "expected_artifacts": [],
    "expected_observation": "6 passed"
  },
  {
    "case_id": "failure-path-traversal-denied",
    "kind": "failure",
    "argv": [
      "uv",
      "run",
      "pytest",
      "tests/security/test_policy.py::test_path_traversal_denied",
      "-q"
    ],
    "stdin_fixture": null,
    "environment": {},
    "fault_fixture": null,
    "expected_exit": 0,
    "expected_artifacts": [],
    "expected_observation": "1 passed"
  }
]
