[
  {
    "case_id": "happy-single-writer-legal-path",
    "kind": "happy",
    "argv": [
      "uv",
      "run",
      "pytest",
      "tests/job_runner/test_concurrency.py::test_single_writer_completes_legal_path",
      "-q"
    ],
    "stdin_fixture": null,
    "environment": {},
    "fault_fixture": null,
    "expected_exit": 0,
    "expected_artifacts": [],
    "expected_observation": "1 passed"
  },
  {
    "case_id": "failure-two-writers-superseded",
    "kind": "failure",
    "argv": [
      "uv",
      "run",
      "pytest",
      "tests/job_runner/test_concurrency.py::test_two_writers_race_same_transition_one_superseded",
      "-q"
    ],
    "stdin_fixture": null,
    "environment": {},
    "fault_fixture": null,
    "expected_exit": 0,
    "expected_artifacts": [],
    "expected_observation": "1 passed"
  },
  {
    "case_id": "failure-stale-parent-superseded",
    "kind": "failure",
    "argv": [
      "uv",
      "run",
      "pytest",
      "tests/job_runner/test_concurrency.py::test_stale_parent_hash_superseded",
      "-q"
    ],
    "stdin_fixture": null,
    "environment": {},
    "fault_fixture": null,
    "expected_exit": 0,
    "expected_artifacts": [],
    "expected_observation": "1 passed"
  },
  {
    "case_id": "failure-expired-lease-late-writer-superseded",
    "kind": "failure",
    "argv": [
      "uv",
      "run",
      "pytest",
      "tests/job_runner/test_concurrency.py::test_expired_lease_late_writer_superseded",
      "-q"
    ],
    "stdin_fixture": null,
    "environment": {},
    "fault_fixture": null,
    "expected_exit": 0,
    "expected_artifacts": [],
    "expected_observation": "1 passed"
  },
  {
    "case_id": "failure-illegal-gate-transition-cannot-commit",
    "kind": "failure",
    "argv": [
      "uv",
      "run",
      "pytest",
      "tests/job_runner/test_state_machine.py::test_preview_ready_to_resolve_built_without_approval_refused",
      "-q"
    ],
    "stdin_fixture": null,
    "environment": {},
    "fault_fixture": null,
    "expected_exit": 0,
    "expected_artifacts": [],
    "expected_observation": "1 passed"
  }
]
