[
 {
  "case_id": "happy-offline-units-pass",
  "kind": "happy",
  "argv": [
   "uv",
   "run",
   "pytest",
   "tests/phase3/test_gate_units.py",
   "-q",
   "-m",
   "not resolve_live and not cloud_fixture"
  ],
  "stdin_fixture": null,
  "environment": {},
  "fault_fixture": null,
  "expected_exit": 0,
  "expected_artifacts": [],
  "expected_observation": "passed"
 },
 {
  "case_id": "happy-complete-ab-swap-gate-passes",
  "kind": "happy",
  "argv": [
   "uv",
   "run",
   "python",
   "-m",
   "services.job_runner.run_gate",
   "phase-3",
   "--policy",
   "config/gates/phase-3-v1.json",
   "--evidence",
   "/Users/stc/Developer/davinci-agent/.omo/start-work/attempts/0d13f6a4397e3f032d918760cb1708dffa523c6db975a8267d511b103b0e4b75/phase-3"
  ],
  "stdin_fixture": null,
  "environment": {
   "RESOLVE_HOST_REPORT": "/Users/stc/Developer/davinci-agent/.omo/start-work/attempts/0d13f6a4397e3f032d918760cb1708dffa523c6db975a8267d511b103b0e4b75/resolve-host.json"
  },
  "fault_fixture": null,
  "expected_exit": 0,
  "expected_artifacts": [],
  "expected_observation": "phase3-gate PASS gate-result="
 },
 {
  "case_id": "failure-editorial-structure-drift",
  "kind": "failure",
  "argv": [
   "uv",
   "run",
   "python",
   "-m",
   "services.job_runner.run_gate",
   "phase-3",
   "--policy",
   "config/gates/phase-3-v1.json",
   "--evidence",
   "/tmp/phase3-qa-fault-evidence"
  ],
  "stdin_fixture": null,
  "environment": {},
  "fault_fixture": "tests/fixtures/phase3-gate-faults/editorial_structure_drift.json",
  "expected_exit": 0,
  "expected_artifacts": [],
  "expected_observation": "detected=true expected_code=ab-structure-drift"
 },
 {
  "case_id": "failure-one-profile-only-success",
  "kind": "failure",
  "argv": [
   "uv",
   "run",
   "python",
   "-m",
   "services.job_runner.run_gate",
   "phase-3",
   "--policy",
   "config/gates/phase-3-v1.json",
   "--evidence",
   "/tmp/phase3-qa-fault-evidence"
  ],
  "stdin_fixture": null,
  "environment": {},
  "fault_fixture": "tests/fixtures/phase3-gate-faults/one_profile_only.json",
  "expected_exit": 0,
  "expected_artifacts": [],
  "expected_observation": "detected=true expected_code=one-profile-only-success"
 },
 {
  "case_id": "failure-channel-id-branch",
  "kind": "failure",
  "argv": [
   "uv",
   "run",
   "python",
   "-m",
   "services.job_runner.run_gate",
   "phase-3",
   "--policy",
   "config/gates/phase-3-v1.json",
   "--evidence",
   "/tmp/phase3-qa-fault-evidence"
  ],
  "stdin_fixture": null,
  "environment": {},
  "fault_fixture": "tests/fixtures/phase3-gate-faults/channel_branch.json",
  "expected_exit": 0,
  "expected_artifacts": [],
  "expected_observation": "detected=true expected_code=channel-branch-present"
 },
 {
  "case_id": "failure-stale-asset",
  "kind": "failure",
  "argv": [
   "uv",
   "run",
   "python",
   "-m",
   "services.job_runner.run_gate",
   "phase-3",
   "--policy",
   "config/gates/phase-3-v1.json",
   "--evidence",
   "/tmp/phase3-qa-fault-evidence"
  ],
  "stdin_fixture": null,
  "environment": {},
  "fault_fixture": "tests/fixtures/phase3-gate-faults/stale_asset.json",
  "expected_exit": 0,
  "expected_artifacts": [],
  "expected_observation": "detected=true expected_code=stale-asset"
 },
 {
  "case_id": "failure-fallback-to-manual",
  "kind": "failure",
  "argv": [
   "uv",
   "run",
   "python",
   "-m",
   "services.job_runner.run_gate",
   "phase-3",
   "--policy",
   "config/gates/phase-3-v1.json",
   "--evidence",
   "/tmp/phase3-qa-fault-evidence"
  ],
  "stdin_fixture": null,
  "environment": {},
  "fault_fixture": "tests/fixtures/phase3-gate-faults/fallback_to_manual.json",
  "expected_exit": 0,
  "expected_artifacts": [],
  "expected_observation": "detected=true expected_code=fallback-to-manual"
 },
 {
  "case_id": "failure-rights-issue",
  "kind": "failure",
  "argv": [
   "uv",
   "run",
   "python",
   "-m",
   "services.job_runner.run_gate",
   "phase-3",
   "--policy",
   "config/gates/phase-3-v1.json",
   "--evidence",
   "/tmp/phase3-qa-fault-evidence"
  ],
  "stdin_fixture": null,
  "environment": {},
  "fault_fixture": "tests/fixtures/phase3-gate-faults/rights_issue.json",
  "expected_exit": 0,
  "expected_artifacts": [],
  "expected_observation": "detected=true expected_code=rights-issue"
 },
 {
  "case_id": "failure-phase4-import",
  "kind": "failure",
  "argv": [
   "uv",
   "run",
   "python",
   "-m",
   "services.job_runner.run_gate",
   "phase-3",
   "--policy",
   "config/gates/phase-3-v1.json",
   "--evidence",
   "/tmp/phase3-qa-fault-evidence"
  ],
  "stdin_fixture": null,
  "environment": {},
  "fault_fixture": "tests/fixtures/phase3-gate-faults/phase4_import.json",
  "expected_exit": 0,
  "expected_artifacts": [],
  "expected_observation": "detected=true expected_code=phase4-import-attempted"
 }
]
