[
  {"case_id":"happy-materialize-and-real-ffprobe-verify","kind":"happy","argv":["uv","run","python","-m","services.fixtures.materialize","p0a-cfr30-fixed","--policy","config/gates/phase-0a-v1.json"],"stdin_fixture":null,"environment":{},"fault_fixture":null,"expected_exit":0,"expected_artifacts":["/Users/stc/Developer/davinci-agent/.omo/start-work/attempts/0d13f6a4397e3f032d918760cb1708dffa523c6db975a8267d511b103b0e4b75/phase-0a/fixture/source.mov","/Users/stc/Developer/davinci-agent/.omo/start-work/attempts/0d13f6a4397e3f032d918760cb1708dffa523c6db975a8267d511b103b0e4b75/phase-0a/fixture/materialization-report.json"],"expected_observation":"fixture materialized and verified: p0a-cfr30-fixed"},
  {"case_id":"failure-generator-and-vfr-drift","kind":"failure","argv":["uv","run","pytest","tests/phase0a/test_fixture_contract.py::test_generator_or_vfr_drift_is_rejected","-q"],"stdin_fixture":null,"environment":{},"fault_fixture":null,"expected_exit":0,"expected_artifacts":[],"expected_observation":"2 passed"},
  {"case_id":"failure-audio-offset","kind":"failure","argv":["uv","run","pytest","tests/phase0a/test_fixture_contract.py::test_audio_offset_is_rejected","-q"],"stdin_fixture":null,"environment":{},"fault_fixture":null,"expected_exit":0,"expected_artifacts":[],"expected_observation":"1 passed"},
  {"case_id":"failure-unknown-preset","kind":"failure","argv":["uv","run","pytest","tests/phase0a/test_fixture_contract.py::test_unknown_preset_is_rejected","-q"],"stdin_fixture":null,"environment":{},"fault_fixture":null,"expected_exit":0,"expected_artifacts":[],"expected_observation":"1 passed"},
  {"case_id":"failure-changed-expected-hash","kind":"failure","argv":["uv","run","pytest","tests/phase0a/test_fixture_contract.py::test_changed_expected_values_cannot_reuse_frozen_hash","-q"],"stdin_fixture":null,"environment":{},"fault_fixture":null,"expected_exit":0,"expected_artifacts":[],"expected_observation":"1 passed"},
  {"case_id":"failure-stale-output-no-misleading-success","kind":"failure","argv":["uv","run","pytest","tests/phase0a/test_fixture_contract.py::test_failed_drift_run_cannot_claim_stale_output_as_success","-q"],"stdin_fixture":null,"environment":{},"fault_fixture":null,"expected_exit":0,"expected_artifacts":[],"expected_observation":"1 passed"},
  {"case_id":"failure-attempted-policy-relock","kind":"failure","argv":["uv","run","pytest","tests/fixtures/test_phase0a.py::test_same_version_refreeze_is_rejected","-q"],"stdin_fixture":null,"environment":{},"fault_fixture":null,"expected_exit":0,"expected_artifacts":[],"expected_observation":"1 passed"},
  {"case_id":"failure-hung-media-command-bounded","kind":"failure","argv":["uv","run","pytest","tests/phase0a/test_fixture_contract.py::test_media_commands_are_bounded","-q"],"stdin_fixture":null,"environment":{},"fault_fixture":null,"expected_exit":0,"expected_artifacts":[],"expected_observation":"1 passed"},
  {"case_id":"flaky-double-run-semantic-equivalence","kind":"happy","argv":["uv","run","pytest","tests/phase0a/test_fixture_contract.py::test_materializes_registered_fixture_from_frozen_policy","-q"],"stdin_fixture":null,"environment":{},"fault_fixture":null,"expected_exit":0,"expected_artifacts":["/Users/stc/Developer/davinci-agent/.omo/start-work/attempts/0d13f6a4397e3f032d918760cb1708dffa523c6db975a8267d511b103b0e4b75/phase-0a/fixture/materialization-report.json"],"expected_observation":"1 passed"}
]
