[
 {
  "case_id": "happy-eligible-rebuildables-delete-after-verified-freeze",
  "kind": "happy",
  "argv": [
   "uv",
   "run",
   "pytest",
   "tests/retention/test_gc.py::test_frozen_job_rebuildables_deleted_after_retention_period",
   "-q"
  ],
  "stdin_fixture": null,
  "environment": {},
  "fault_fixture": null,
  "expected_exit": 0,
  "expected_artifacts": [],
  "expected_observation": "1 passed"
 },
 {
  "case_id": "failure-active-held",
  "kind": "failure",
  "argv": [
   "uv",
   "run",
   "pytest",
   "tests/retention/test_holds.py::test_active_job_holds_block_rebuildable_deletion",
   "-q"
  ],
  "stdin_fixture": null,
  "environment": {},
  "fault_fixture": null,
  "expected_exit": 0,
  "expected_artifacts": [],
  "expected_observation": "1 passed"
 },
 {
  "case_id": "failure-failed-held",
  "kind": "failure",
  "argv": [
   "uv",
   "run",
   "pytest",
   "tests/retention/test_holds.py::test_failed_job_holds_block_rebuildable_deletion",
   "-q"
  ],
  "stdin_fixture": null,
  "environment": {},
  "fault_fixture": null,
  "expected_exit": 0,
  "expected_artifacts": [],
  "expected_observation": "1 passed"
 },
 {
  "case_id": "failure-authoritative-retained",
  "kind": "failure",
  "argv": [
   "uv",
   "run",
   "pytest",
   "tests/retention/test_gc.py::test_authoritative_and_manual_finalization_always_retained",
   "-q"
  ],
  "stdin_fixture": null,
  "environment": {},
  "fault_fixture": null,
  "expected_exit": 0,
  "expected_artifacts": [],
  "expected_observation": "1 passed"
 },
 {
  "case_id": "failure-symlink-target-retained",
  "kind": "failure",
  "argv": [
   "uv",
   "run",
   "pytest",
   "tests/retention/test_traversal.py::test_symlink_pointing_outside_retained_and_reported",
   "-q"
  ],
  "stdin_fixture": null,
  "environment": {},
  "fault_fixture": null,
  "expected_exit": 0,
  "expected_artifacts": [],
  "expected_observation": "1 passed"
 },
 {
  "case_id": "failure-tampered-registry-retained",
  "kind": "failure",
  "argv": [
   "uv",
   "run",
   "pytest",
   "tests/retention/test_registry.py::test_tampered_registry_entry_retained_and_reported",
   "-q"
  ],
  "stdin_fixture": null,
  "environment": {},
  "fault_fixture": null,
  "expected_exit": 0,
  "expected_artifacts": [],
  "expected_observation": "1 passed"
 }
]
