[
 {
  "case_id": "happy-complete-synthetic-technical-labeled",
  "kind": "happy",
  "argv": [
   "uv",
   "run",
   "pytest",
   "tests/metrics/test_cli.py::test_cli_complete_technical_bundle_valid_and_labeled",
   "-q"
  ],
  "stdin_fixture": null,
  "environment": {},
  "fault_fixture": null,
  "expected_exit": 0,
  "expected_artifacts": [],
  "expected_observation": "1 passed"
 },
 {
  "case_id": "failure-hidden-out-of-contract",
  "kind": "failure",
  "argv": [
   "uv",
   "run",
   "pytest",
   "tests/metrics/test_validate.py::test_hidden_undeclared_episode_fails_validation",
   "-q"
  ],
  "stdin_fixture": null,
  "environment": {},
  "fault_fixture": null,
  "expected_exit": 0,
  "expected_artifacts": [],
  "expected_observation": "1 passed"
 },
 {
  "case_id": "failure-missing-timestamps",
  "kind": "failure",
  "argv": [
   "uv",
   "run",
   "pytest",
   "tests/metrics/test_timing.py::test_missing_timestamps_not_evaluated_never_zero",
   "-q"
  ],
  "stdin_fixture": null,
  "environment": {},
  "fault_fixture": null,
  "expected_exit": 0,
  "expected_artifacts": [],
  "expected_observation": "1 passed"
 },
 {
  "case_id": "failure-false-real-approval",
  "kind": "failure",
  "argv": [
   "uv",
   "run",
   "pytest",
   "tests/metrics/test_validate.py::test_real_timing_without_genuine_approval_fails",
   "-q"
  ],
  "stdin_fixture": null,
  "environment": {},
  "fault_fixture": null,
  "expected_exit": 0,
  "expected_artifacts": [],
  "expected_observation": "1 passed"
 },
 {
  "case_id": "failure-unsupported-kpi-claim",
  "kind": "failure",
  "argv": [
   "uv",
   "run",
   "pytest",
   "tests/metrics/test_validate.py::test_unsupported_median_claim_from_technical_fixtures_typed",
   "-q"
  ],
  "stdin_fixture": null,
  "environment": {},
  "fault_fixture": null,
  "expected_exit": 0,
  "expected_artifacts": [],
  "expected_observation": "1 passed"
 },
 {
  "case_id": "failure-broken-trace",
  "kind": "failure",
  "argv": [
   "uv",
   "run",
   "pytest",
   "tests/metrics/test_trace.py::test_broken_trace_fails_validation_typed",
   "-q"
  ],
  "stdin_fixture": null,
  "environment": {},
  "fault_fixture": null,
  "expected_exit": 0,
  "expected_artifacts": [],
  "expected_observation": "1 passed"
 }
]
